{
  "profile": "source-record-catalogue-1.0",
  "dataset_id": "synthetic-source-mixed-1.0",
  "release": "authored-1",
  "itemids": [
    "1000"
  ],
  "source_sha256": {
    "inputevents": "1da03f5affbd0cfa3cb105dba6d128683fe6dd4be5f9cc91ef0f60a896551884",
    "icustays": "add9e84050e9b5da0d5a2ca9bddc30084dc770e3ba647853bfdf0970fc8e5c6a",
    "d_items": "96bd5284a8c8de4736bf5e7361345fbbe10c8ef530dd3b13337b3a3e85ac625f"
  }
}
